[
  {"id":"FZMT-01","title":"Indikator ohne Trading-Fläche laden","category":"settings","risk":"safe_non_trading","steps":["Fractal Zones einem normalen Chart hinzufügen.","Prüfen, dass keine Order-, Konto- oder Strategieaktion angeboten wird."],"expected":["Indikator und Einstellungen sind sichtbar.","Es existiert keine Trading-Funktion."],"restoration":"Indikator kann auf dem Testchart verbleiben."},
  {"id":"FZMT-02","title":"29 Produkt-Settings und Sichtbarkeitszweige inventarisieren","category":"settings","risk":"safe_non_trading","steps":["Alle Gruppen im Settings-Dialog öffnen.","ATR, Percent, Fixed ticks und Active focus nacheinander wählen.","Fixed range und Chart loaded range plus warm-up nacheinander wählen."],"expected":["29 produktseitige Zeilen sind vorhanden.","Abhängige Felder erscheinen nur im passenden Zweig."],"restoration":"Standardwerte wiederherstellen."},
  {"id":"FZMT-03","title":"Maturity in Minuten bestätigen","category":"lifecycle","risk":"safe_non_trading","steps":["Before und After auf 30 Minuten setzen.","Chart-Timeframe zwischen 1 und 5 Minuten wechseln."],"expected":["Bestätigung folgt der Zeitdauer, nicht der Anzahl sichtbarer Chartkerzen."],"restoration":"30/30 Minuten belassen."},
  {"id":"FZMT-04","title":"Provisional zu Active segmenttreu prüfen","category":"lifecycle","risk":"safe_non_trading","steps":["Eine neue provisorische Linie beobachten.","Bis zur bestätigten Maturity warten oder historische Evidenz verwenden."],"expected":["Vergangener Abschnitt bleibt Dot.","Abschnitt ab Bestätigung wird Solid."],"restoration":"Keine Änderung erforderlich."},
  {"id":"FZMT-05","title":"ATR-Bruchdistanz prüfen","category":"lifecycle","risk":"safe_non_trading","steps":["One-minute ATR wählen.","ATR period 60, multiplier 0,5 und Minimum 2 Ticks verwenden.","Einen bestätigten Bruch beobachten."],"expected":["Bruchgrenze passt sich der MIN1-Volatilität an.","Mindestabstand bleibt eingehalten."],"restoration":"ATR-Standardwerte belassen."},
  {"id":"FZMT-06","title":"Percent-of-level-Bruchdistanz prüfen","category":"lifecycle","risk":"safe_non_trading","steps":["Percent of level wählen.","0,05 Prozent und Minimum 2 Ticks setzen."],"expected":["Grenze skaliert relativ zum Level und wird outward quantisiert."],"restoration":"One-minute ATR wiederherstellen."},
  {"id":"FZMT-07","title":"Fixed-ticks-Bruchdistanz prüfen","category":"lifecycle","risk":"safe_non_trading","steps":["Fixed ticks wählen.","2 Ticks setzen und ein geeignetes historisches Beispiel prüfen."],"expected":["Distanz bleibt exakt tickbasiert und beachtet das Instrumentraster."],"restoration":"One-minute ATR wiederherstellen."},
  {"id":"FZMT-08","title":"Strikten Timer-Reset prüfen","category":"lifecycle","risk":"safe_non_trading","steps":["Einen kurzen Grenzübertritt beobachten.","Rückkehr in die Neutralzone feststellen.","Erneuten Grenzübertritt beobachten."],"expected":["Erster Timer wird sofort verworfen.","Neuer Versuch startet nicht im selben Slot."],"restoration":"Keine Änderung erforderlich."},
  {"id":"FZMT-09","title":"Cooldown gegen Mehrfachbruch prüfen","category":"lifecycle","risk":"safe_non_trading","steps":["Minimum between breaks auf 5 Minuten belassen.","Seitwärtsbewegung um das Level untersuchen."],"expected":["Keine mehrfachen committed breaks innerhalb des Cooldowns."],"restoration":"5 Minuten belassen."},
  {"id":"FZMT-10","title":"BrokenWatch und Dash prüfen","category":"lifecycle","risk":"safe_non_trading","steps":["Einen bestätigten ersten Bruch identifizieren."],"expected":["Linie wird ab Bruch als historische Dash-Segmentfortsetzung gezeigt."],"restoration":"Keine Änderung erforderlich."},
  {"id":"FZMT-11","title":"RoleChange und Ursprungsfarbe prüfen","category":"lifecycle","risk":"safe_non_trading","steps":["Einen bestätigten Retest mit Rollenwechsel identifizieren."],"expected":["Linie wird wieder Active/Solid.","Top- oder Bottom-Ursprungsfarbe bleibt unverändert."],"restoration":"Keine Änderung erforderlich."},
  {"id":"FZMT-12","title":"RoleReaffirmation prüfen","category":"lifecycle","risk":"safe_non_trading","steps":["Eine Bestätigung derselben Rolle identifizieren."],"expected":["Linie wird Active/Solid.","CurrentRole bleibt unverändert."],"restoration":"Keine Änderung erforderlich."},
  {"id":"FZMT-13","title":"Terminales Ended prüfen","category":"lifecycle","risk":"safe_non_trading","steps":["End on current-role break number auf 3 belassen.","Eine Linie mit drittem committed current-role break untersuchen."],"expected":["Linie endet exakt am Commit-Zeitpunkt.","Nach dem Ende wird kein Liniensegment gezeichnet."],"restoration":"Wert 3 belassen."},
  {"id":"FZMT-14","title":"Adaptive, Full und Active focus vergleichen","category":"rendering","risk":"safe_non_trading","steps":["Denselben Chart in allen drei Modi ansehen.","Linien- und Markeranzahl vergleichen."],"expected":["Semantischer Inhalt bleibt identisch.","Es gibt kein Clustering, Merging, Sampling oder Suppression."],"restoration":"Adaptive wiederherstellen."},
  {"id":"FZMT-15","title":"Active-focus-Deckkraft prüfen","category":"rendering","risk":"safe_non_trading","steps":["Active focus wählen.","Inactive state opacity zwischen 0,10 und 1,00 ändern."],"expected":["Nur Provisional und BrokenWatch ändern ihre Deckkraft."],"restoration":"Adaptive und 0,35 wiederherstellen."},
  {"id":"FZMT-16","title":"Marker-Schalter prüfen","category":"rendering","risk":"safe_non_trading","steps":["End-, Break- und Role-change-Marker einzeln umschalten."],"expected":["Nur der jeweilige Markertyp ändert seine Sichtbarkeit.","Keine Neuberechnung der Level wird ausgelöst."],"restoration":"End true, Break false, Role-change true."},
  {"id":"FZMT-17","title":"Timeframe-Parität prüfen","category":"history","risk":"safe_non_trading","steps":["Gleichen Symbol- und Zeitbereich auf 1m, 5m und einem höheren Timeframe vergleichen."],"expected":["Quelle-identische Level und Zustände stimmen zeitlich überein."],"restoration":"Ausgangs-Timeframe wiederherstellen."},
  {"id":"FZMT-18","title":"90-Tage-Standard gegen Chart-Warm-up vergleichen","category":"history","risk":"safe_non_trading","steps":["Fixed initial history days mit 90 Tagen prüfen.","Chart loaded range plus warm-up wählen."],"expected":["Chart-Modus begrenzt die Berechnung sinnvoll und ergänzt erforderlichen Warm-up.","Sichtbare gemeinsame Ergebnisse stimmen überein."],"restoration":"Fixed initial history days und 90 wiederherstellen."},
  {"id":"FZMT-19","title":"Expliziten Calculation start prüfen","category":"history","risk":"safe_non_trading","steps":["Calculation start aktivieren und einen sicheren historischen Zeitpunkt wählen.","Zeitzonenanzeige prüfen."],"expected":["Initial range ist deaktiviert.","Anzeige nutzt die Plattformzeitzone, intern bleibt UTC deterministisch."],"restoration":"Calculation start deaktivieren."},
  {"id":"FZMT-20","title":"Checkpoint-Restart prüfen","category":"recovery","risk":"safe_non_trading","steps":["Enable semantic replay checkpoint aktivieren.","Nach erzeugtem Checkpoint Quantower über den freigegebenen manuellen Testablauf neu starten."],"expected":["Validierter Restore entspricht dem Rohneuaufbau.","Bei ungültigem Zustand erfolgt sicherer Rebuild."],"restoration":"Checkpoint deaktivieren, sofern nicht weiter getestet."},
  {"id":"FZMT-21","title":"Deep Verify Single-Flight und Cancel prüfen","category":"recovery","risk":"safe_non_trading","steps":["Verify full history now… zweimal kurz nacheinander auslösen.","Cancel full-history verify auslösen."],"expected":["Nur ein Job läuft.","Cancel beendet nur optionalen Verify und publiziert keinen Teilstand."],"restoration":"Bis Idle oder Cancelled warten."},
  {"id":"FZMT-22","title":"Recoverable Incomplete bei Datenlücke prüfen","category":"recovery","risk":"safe_non_trading","steps":["Ein bekanntes Datenlücken-Szenario oder sanitisiertes Diagnosebeispiel verwenden."],"expected":["Indikator bleibt responsiv.","DataStatus und DATA GAP/EPOCH weisen auf die begrenzte Unsicherheit hin."],"restoration":"Nach Datenwiederkehr Recovery abwarten."},
  {"id":"FZMT-23","title":"7/30/90/365-Tage-Performance prüfen","category":"performance","risk":"safe_non_trading","steps":["Vier feste Historienfenster mit identischem Instrument und Modus messen.","FZPERF nur sanitisiert auswerten."],"expected":["UI bleibt responsiv.","Wachstum und Rangewechsel sind nachvollziehbar und ohne Semantikverlust."],"restoration":"90-Tage-Standard wiederherstellen."},
  {"id":"FZMT-24","title":"Lokale Testdaten und Exportdatenschutz prüfen","category":"privacy","risk":"safe_non_trading","steps":["Status ändern und eine harmlose Notiz erfassen.","JSON ohne Notizen und danach optional mit Notizen exportieren.","Export wieder importieren."],"expected":["Ohne Opt-in fehlen Notizen vollständig.","Import akzeptiert nur das geschlossene Schema und sendet nichts an einen Server."],"restoration":"Lokalen Testfortschritt bei Bedarf über Reset löschen."}
]
