[
  {"id":"FZCURRENT-001","title":"V5/V6-Status sauber trennen","priority":"1 – Kritisch","description":"Die aktuelle Suite ist quellvalidiert, aber noch keine Runtime- oder Benutzerabnahme.","steps":["Die Seite Aktueller Stand öffnen.","V5 und V6 getrennt von der historischen V1–V4-Evidenz lesen."],"expected":["Beide aktuellen Suites stehen auf sourceValidatedRuntimePending.","Kein Runtime-PASS wird daraus abgeleitet."],"restoration":"Keine Änderung erforderlich."},
  {"id":"FZCURRENT-002","title":"Vier Berechnungsbereichsmodi prüfen","priority":"1 – Kritisch","description":"Calculation range mode enthält vier statt drei Modi.","steps":["Den Selector öffnen.","Die vier Optionen nacheinander identifizieren."],"expected":["Fixed lookback, Fixed calculation start, Chart loaded range plus warm-up und Dynamic active-level price range sind vorhanden."],"restoration":"Ausgangsmodus wiederherstellen."},
  {"id":"FZCURRENT-003","title":"Dynamischen Preisbereich prüfen","priority":"1 – Kritisch","description":"Der dynamische Modus begrenzt Berechnungs-/Publikationsscope aktivierter Levels, nicht die Rendersemantik.","steps":["Dynamischen Modus wählen.","Active-level price range (+/- %) sichtbar prüfen."],"expected":["Der Standardwert ist 10,00 %.","Kein Clustering, Merging, Sampling oder Suppression wird ausgelöst."],"restoration":"Ausgangsmodus und Ausgangswert wiederherstellen."},
  {"id":"FZCURRENT-004","title":"Dynamischen Historienhorizont prüfen","priority":"1 – Kritisch","description":"Der dynamische Modus besitzt einen Provider- und einen begrenzten Tageshorizont.","steps":["Dynamic history horizon öffnen.","All available provider history und Bounded days wählen."],"expected":["Dynamic history (days) wird nur bei Bounded days sichtbar.","Der Standard im Begrenzungsfeld ist 365."],"restoration":"All available provider history und Ausgangsmodus wiederherstellen."},
  {"id":"FZCURRENT-005","title":"Expected-side V2 gegen Tooltip prüfen","priority":"1 – Kritisch","description":"Die Engine bewertet die erwartete Seite; eine eventuell ältere Tooltip-Formulierung darf das nicht überschreiben.","steps":["Break price source Close und High/Low vergleichen.","Nur beobachtbare Text- und Zustandsinformationen notieren."],"expected":["Resistance prüft die obere, Support die untere erwartete Seite.","Ein Tooltip-Widerspruch wird als Residual, nicht als neue Engine-Regel geführt."],"restoration":"Break price source auf den Ausgangswert zurückstellen."},
  {"id":"FZCURRENT-006","title":"Beidseitige Dochte prüfen","priority":"2 – Hoch","description":"Eine Bar mit beiden Dochten erzeugt nicht automatisch einen zweiten oder neutralen Commit.","steps":["Eine geeignete volatile Bar wählen, falls verfügbar.","Den anschließenden State beobachten."],"expected":["Es gilt die erwartete Seite des Levels.","Keine doppelte Break-Verarbeitung im selben Slot."],"restoration":"Keine Änderung erforderlich."},
  {"id":"FZCURRENT-007","title":"Selector-Persistenz prüfen","priority":"2 – Hoch","description":"Die neun Selector-Einstellungen akzeptieren definierte Auswahlwerte und bleiben nach einem erneuten Öffnen konsistent.","steps":["Je einen Range-, Rendering- und Break-Selector ändern.","Dialog erneut öffnen."],"expected":["Nur der gewählte Selector und seine abhängigen Felder ändern sich.","Ungültige oder alte Werte führen nicht zu einer unkontrollierten Umschaltung."],"restoration":"Alle veränderten Selector-Werte exakt zurückstellen."},
  {"id":"FZCURRENT-008","title":"Mehrblock-Historie beobachten","priority":"2 – Hoch","description":"Lange Historien werden blockweise geladen, ohne synthetische Minuten zu erfinden.","steps":["Ein Instrument mit langer Anbieterhistorie wählen.","Auf Ready oder ein begründetes Incomplete warten."],"expected":["Datenlücken bleiben als Datenstatus sichtbar.","Der Indikator publiziert keinen künstlich vollständigen Teilstand."],"restoration":"Ursprünglichen Chartbereich wiederherstellen."},
  {"id":"FZCURRENT-009","title":"Dynamische Range wechseln","priority":"2 – Hoch","description":"Ein Wechsel zwischen Range-Modi muss konsistent neu aufbauen, ohne Linien zu clustern oder zu löschen.","steps":["Von Chart loaded range plus warm-up zu Dynamic active-level price range wechseln.","Nach Abschluss zurückwechseln."],"expected":["Jeder veröffentlichte Zustand ist vollständig konsistent.","Pan und Zoom sind keine semantische Löschoperation."],"restoration":"Chart loaded range plus warm-up wiederherstellen."},
  {"id":"FZCURRENT-010","title":"Quota-Degradierung einordnen","priority":"2 – Hoch","description":"QuotaExceeded stoppt nur optionale Restore-Point-Schreibvorgänge, nicht Berechnung oder Darstellung.","steps":["Die Performance-und-Sidecar-Dokumentation lesen.","Ein vorhandenes, natürliches Diagnosebeispiel nur kategorisch bewerten."],"expected":["Linien werden nicht wegen einer Quote reduziert.","Berechnung, veröffentlichte Generation und Crashrotation bleiben verfügbar."],"restoration":"Keine Änderung erforderlich."},
  {"id":"FZCURRENT-011","title":"UI-Teilinventur einordnen","priority":"3 – Mittel","description":"Die nicht-tradende UI-Inventur bestätigte produktseitige Settings, LineOptions, Sichtbarkeitszweige und die vier Calculation-Range-Modi. Indikatorversion und vollständige geerbte base.Settings-Union wurden nicht sanitisiert erfasst.","steps":["Keine Action-Einstellung ausführen.","Nur die weiterhin offenen Host-Details getrennt und datensparsam bewerten."],"expected":["Calculation start bleibt unverändert und ist im Fixed-Calculation-Start-Zweig sichtbar.","Keine Konto-, Order-, Positions- oder Verbindungsfläche wird geöffnet."],"restoration":"Alle nur für Sichtbarkeit geänderten Selector-Werte zurückstellen."},
  {"id":"FZCURRENT-012","title":"Lokalen Export prüfen","priority":"3 – Mittel","description":"Die aktuelle Testmatrix bleibt lokal, schema-gebunden und datensparsam.","steps":["Einen Teststatus ändern.","JSON ohne Notizen exportieren und wieder importieren."],"expected":["Der Export verwendet das V3-Schema für FZCURRENT.","Es werden keine Notizen ohne Opt-in und keine Daten an einen Server übertragen."],"restoration":"Lokalen Testfortschritt bei Bedarf zurücksetzen."}
]
